{
  "object_id": "obj_demo_collection",
  "object_type": "pgo_collection_request",
  "schema_version": "1.0.0",
  "revision": 1,
  "created_at": "2026-09-16T12:30:00Z",
  "created_by": "pgp_sample_logistics",
  "input_refs": [
    {
      "object_id": "obj_demo_form_collection_request",
      "revision": 1
    },
    {
      "object_id": "obj_demo_order",
      "revision": 1
    },
    {
      "object_id": "obj_demo_blood",
      "revision": 1
    }
  ],
  "data": {
    "order_ref": {
      "object_id": "obj_demo_order",
      "revision": 1
    },
    "sample_refs": [
      {
        "object_id": "obj_demo_blood",
        "revision": 1
      }
    ],
    "assigned_provider_id": "pgp_sample_logistics",
    "pickup": {
      "location_id": "location_demo_origin",
      "name": "Demo collection site",
      "address_line": "100 Example Avenue",
      "city": "Demo City",
      "country_code": "AR",
      "contact_name": "Demo origin contact",
      "contact_phone": "+54-DEMO-0001"
    },
    "destination": {
      "location_id": "location_demo_lab",
      "name": "Demo laboratory",
      "address_line": "200 Example Avenue",
      "city": "Demo City",
      "country_code": "AR",
      "contact_name": "Demo laboratory contact",
      "contact_phone": "+54-DEMO-0002"
    },
    "window_start": "2026-09-16T13:00:00Z",
    "window_end": "2026-09-16T15:00:00Z",
    "handling_profile": "handling_demo_v1",
    "status": "requested"
  },
  "files": []
}
